type,year,title,author,partof,resources,File,tags,abstract,alias
,2021,Semi-automated methods for BIBFRAME work entity description,Jim Hahn,,,SWIB/SWIB2021/Semi-automated methods for BIBFRAME work entity description.md,"#swib/2021,#BIBFRAME,#LCSH,#Annif,#API","Describing library resources with the BIBFRAME vocabulary and its core entities of Work, Instance, and Item is a resource intensive process. Cataloging in linked data RDF editors with BIBFRAME involves careful selection of, and referencing to, external authority entities. Creating external authoritative links is essential to produce an accurate context while describing the BIBFRAME Work entity in an RDF editor. This presentation will report an investigation of machine learning methods for the semi-automated creation of a BIBFRAME Work entity description within the RDF linked data editor Sinopia. The automated subject indexing software Annif was configured with the Library of Congress Subject Headings (LCSH) vocabulary from the Linked Data Service. A dataset comprising 9.3 million titles and LCSH linked data references from the IvyPlus POD project was used as the training corpus. POD is a data aggregation project involving member institutions of the IvyPlus Library Confederation and contains over seventy million MARC21 records, nearly 40 million of which are unique to the corpus. The machine learning outputs, accessed by Annif web API, enable a feature for dynamically auto suggesting subject attributes based on a cataloger supplied title. This method of research and development is foregrounded with considerations for ethical use of semi-automated subject description. Semi-automation as a potential integration target is in contrast to completely automated cataloging and is a very specific use of machine learning. In this work automation was used as a way to support, not replace, professional expertise.",SWIB
,2021,SkoHub Vocabs,,,,SWIB/SWIB2021/SkoHub Vocabs.md,"#swib/2021,#SkoHub,#Vocabs,#SKOS",SkoHub Vocabs is a static site generator for publishing SKOS concepts schemes on the web.,SWIB
,2021,"SparqlExplorer, exploring Linked Open Data","Fabien Amarger,Elodie Thieblin,Chauvat Nicolas",,,"SWIB/SWIB2021/SparqlExplorer, exploring Linked Open Data.md","#swib/2021,#SPARQL,#SparqlExplorer","Since developing and maintaining web applications is costly, a lot of the data published in SPARQL endpoints is difficult to explore by users that are not experts of LOD tools and languages. In order to make that data more accessible we developed SparqlExplorer, a web application that can be plugged into any SPARQL endpoint to make its content browsable without writing a single query by applying views to render web pages. For example, to explore a dataset about books, SparqlExplorer would use a book-specific views that executes a SPARQL query to retrieve that data related to a book and generate a web page that displays the title, the ISBN and maybe a thumbnail of the cover. Views are javascript functions that take data and output HTML. Views depend on the structure of the input data, but are independent of the SPARQL endpoint. A "Book" view can be reused on all libraries and bookstore SPARQL endpoints that published data using the vocabulary that the view expects as input. Views are simple functions that do not require the developers to have a deep understanding of Semantic Web technologies: usual front-end knowledge is enough. Last but not least, SparqlExplorer is free/libre and open-source software. Do not hesistate to reuse and contribute!",SWIB
,2021,String matching algorithms in OpenRefine clustering and reconciliation functions - a case study of person name matching,Christiane Klaes,,,SWIB/SWIB2021/String matching algorithms in OpenRefine clustering and reconciliation functions - a case study of person name matching.md,"#swib/2021,#OpenRefine,#clustering,#reconciliation,#ElexiFinder,#LexBib","Person entities are important linking nodes both within and between Linked Open Data resources across different domains and use cases. Therefore, efficient identity management is a crucial part of resource development and maintenance. This case study is concerned with the task of semi-automatic population of a newly developed domain knowledge graph, LexBib Wikibase with high-quality person data. We aim to transform person name literals taken from publication metadata into Semantic Web entities, to enable improved retrieval and entity enrichment for the domain-specific discovery portal ElexiFinder. In a prototype workflow, the open source tool OpenRefine is used as a one-tool solution to perform deduplication, disambiguation and reconciliation of person names with reference datasets, using a sample of 3.104 name literals taken from LexBib bibliography. We closely examine OpenRefine’s clustering functions with its underlying string matching algorithms, focusing on their ability to account for different error types that frequently occur in person name matching, such as spelling errors, phonetic variations, initials, or double names. Following the same approach, string matching processes implemented in two widely used reconciliation services for Wikidata and VIAF are examined. OpenRefine offers various features. We also analyse the usefulness of OpenRefine features to support further processing of algorithmic output. The results of this case study may contribute to a better understanding and subsequent further development of interlinking features in OpenRefine and adjoining reconciliation services. By offering empiric data on OpenRefine’s underlying string matching algorithms, the study’s results supplement existing guides and tutorials on clustering and reconciliation, especially for person name matching projects.",SWIB
,2021,Surveillance capitalism in our libraries,Sarah Lamdan,,,SWIB/SWIB2021/Surveillance capitalism in our libraries.md,"#swib/2021,#RELX,#ProQuest","'In the transition from industrial to informational capitalism, much of our lived experience has gone from physical to digital, including library services. As publishers, library vendors, and other informational service providers have become internet-based companies, their business models have transitioned from analog services to data-based services. In short, our traditional library service providers are becoming data analytics companies, dabbling in, or diving into personal data brokering. From RELX to ProQuest, major library vendors are finding new ways to extract and monetize people's personal data. Researchers are finding surveillance software like ThreatMetrix in their research databases, and data analytics companies like Clarivate are trying to acquire ProQuest, a major library service platform provider to exploit library patrons' data to create more academic metrics to sell grant funders and research institutions. All of these corporate decisions are part of a trend of our vendors collecting library patrons' personal data. The increasing surveillance capitalism in our library spaces makes open access more important than ever.'",SWIB
,2021,Using Linked Data relationships to enhance discovery and mitigate bias,Juliet L. Hardesty,,,SWIB/SWIB2021/Using Linked Data relationships to enhance discovery and mitigate bias.md,"#swib/2021,#metadataBias","This presentation will share an open-source JavaScript-based Linked Data project that explores techniques to improve terminology used for discovering resources from systemically marginalized communities (metadataBias). As a research project, it is also investigating a practical application of Linked Data to enhance usability of library systems. Controlled vocabularies used in cultural heritage organizations (galleries, libraries, archives, and museums) are a helpful way to standardize terminology but can also result in misrepresentation or exclusion of systemically marginalized communities. Library of Congress Subject Headings (LCSH) is one example of a widely used yet problematic controlled vocabulary for subject headings. Linked Data vocabularies can connect terms between larger, less representative vocabularies (like LCSH) and terms from a community’s vocabulary to aid and instruct end users conducting research online. This project uses The Homosaurus, an LGBTQ+ Linked Data controlled vocabulary, to provide an augmented and updated search experience to mitigate bias within a system that only uses LCSH for subject headings. The presentation will provide a demonstration, share progress to date on research findings, usability feedback, and implementation, instructions for how to use or contribute to this research, as well as plans for further development.",SWIB
,2021,Using linked data notifications to assemble the scholarly record on the decentralised web,"Patrick Hochstenbach,Ruben Dedecker,Miel Vander Sande,Jeroen Werbrouck,Herbert van de Sompel,Ruben Verborgh",,,SWIB/SWIB2021/Using linked data notifications to assemble the scholarly record on the decentralised web.md,"#swib/2021,#decentralised-architecture,#Decentralised-Web","In this presentation we present the results of the Mellon funded Scholarly Communication project that proposes a decentralised architecture for generating, propagating and notification of artefact lifecycle information in scholarly networks. Scholarly artefacts go through many stages from the creation of artefacts, through the registration of these artefacts in repositories, requesting certification at a publisher websites where they will be peer-reviewed and eventually published, to the archivation in a (web) archive. The results of each of these events are typically stored in different environments that are rarely interconnected. This makes assembling the complete lifecycle of artefacts an expensive post-factum endeavour involving mining many information sources and applying heuristics to combine the information into a meaningful result. The Mellon Scholarly Communication project proposes a researcher-centric, institution-enabled scholarly communication system aligned with Decentralised Web concepts and technologies. In this vision researchers use a personal domain and associated storage space (researcher pod) as their long-term scholarly hub. Using Linked Data Notifications these scholarly hubs communicate with service hubs (such as peer review systems, discovery systems, archives) for the fulfilment of the functions of scholarly communication. The research pod stores all the information pertaining to the artefacts that the researcher contributes to the scholarly record where it can be shared and consulted.",SWIB
,2021,Web editor for JSON/Bibframe data in libraries,Nicolas Prongué,,,SWIB/SWIB2021/Web editor for JSONBibframe data in libraries.md,"#swib/2021,#Bibframe,#JSON,#JSON-LD,#RERO+,#Swiss,#ILS","This presentation shows a cataloguing form created to edit data stored in a Bibframe/JSON format. It points out the specificities, obstacles, advantages and difficulties of this implementation in comparison to a raw MARC editor. On the one hand, the interface must be really user-friendly, as it is targeted at public, school and special libraries. On the other hand, it must enable to receive granular bibliographic records from MARC and to edit JSON data that is hierarchically structured and deeply nested, composed of a multitude of fields with different conditionalities and validation rules. The system does not enable to create directly RDF data but it represents, in the specific library context, a relevant step towards the edition of linked and interoperable data. The next step regarding semantic web is to define a transformation and context for exposing this data in JSON-LD. This happens within the transition of RERO+, a Swiss competence and service centre for libraries, to an open source and in house library system called RERO ILS. About 60 libraries in Switzerland are using it since July 2021. In this context, it was decided to abandon MARC21 in favour of JSON, using the Bibframe model as far as possible and maintaining an interoperability for data import/export. RERO ILS is based on the Invenio 3 framework proposed by CERN, which heavily relies on JSON and JSON schema for resource management. The editor is also implemented within SONAR, another RERO+ software made to manage institutional repositories. RERO ILS source code: https://github.com/rero/rero-ils/",SWIB
,2021,"coli-ana – Automatic analysis of the Dewey Decimal Classification, a service of the Verbundzentrale des GBV","Uma Balakrishnan,Stefan Peters,Jakob Voss",,,"SWIB/SWIB2021/coli-ana – Automatic analysis of the Dewey Decimal Classification, a service of the Verbundzentrale des GBV.md","#swib/2021,#DDC,#dewey-decimal-classification,#VZG-colibri,#project,#coli-ana,#enrich,#K10plus","Dewey Decimal Classification (DDC) is the most widely used classification system internationally. It was developed by Melvil Dewey in 1873 based on the Decimal Classification conceived by Gottfried Wilhelm Leibniz in the 17ᵗʰ century. At the dawn of the 21ᵗʰ century, DDC attracted great interest amongst academic libraries in Europe, and was translated into German and several other European languages. The contemporary Dewey Decimal System with over 48.000 classes and six tables allows a huge flexibility and fineness in building new numbers such as 700.90440747471. However, this process is complex and is based on several intricate rules and instructions. The lack of captions in such built numbers makes it difficult to understand and re-use by the non-Dewey catalogers. Thus, in 2003 under the project VZG-colibri, a sub-project coli-ana was initiated to develop a tool that would automatically decompose and analyze any given DDC notation to its tiniest component, enrich them with their caption, and provide the semantic relationship between each element in JSKOS (a JSON-LD format based on SKOS). The results of coli-ana improve information retrieval, facilitate re-use, and aid further study to enhance knowledge organization systems in general. coli-ana delivers DDC captions only in German, but it is planned to integrate the English version of DDC as well. The results of the tool are incorporated in the mapping tool Cocoda as well to assist mappings to and from DDC built numbers. This talk will give a brief background of the project coli-ana, elucidate with examples the decomposition of notations with their adherent rules and instructions, present the coli-ana web service as well as demonstrate its use cases in the project coli-conc and in the K10plus union catalogue.",SWIB
,2021,"coli-conc infrastructure (Cocoda mapping tool, BARTOC, coli-ana…)",Nich Tich,,,"SWIB/SWIB2021/coli-conc infrastructure (Cocoda mapping tool, BARTOC, coli-ana…).md","#swib/2021,#coli-conc,#Cocoda,#booth,#BARTOC,#coli-ana,#JSKOS,#API","Description: Project coli-conc subsumes services and standards to facilitate working with controlled vocabularies and mappings between their concepts. We welcome questions and discussion around these topics, including the mapping tool Cocoda, BARTOC vocabulary registry, coli-ana DDC decomposition, JSKOS data format and API etc.",SWIB